{"cases":[{"category":"ambiguous","expected_alternatives":["interaction-and-collaboration","tool-execution"],"expected_area_id":null,"expected_module_ids":[],"expected_status":"ambiguous","id":"ambiguous.cross-area.01","query":"MCP vagy több ügynök együttműködés?"},{"category":"ambiguous","expected_alternatives":["coding-agents","context-and-knowledge"],"expected_area_id":null,"expected_module_ids":[],"expected_status":"ambiguous","id":"ambiguous.cross-area.02","query":"Kontextustömörítés vagy kódgenerálás?"},{"category":"ambiguous","expected_alternatives":["multi-agent-coordination","real-time-multimodal"],"expected_area_id":null,"expected_module_ids":[],"expected_status":"ambiguous","id":"ambiguous.cross-area.03","query":"Voice pipeline vagy manager worker?"},{"category":"ambiguous","expected_alternatives":["continual-evolution","model-post-training"],"expected_area_id":null,"expected_module_ids":[],"expected_status":"ambiguous","id":"ambiguous.cross-area.04","query":"SFT RL vagy offline konszolidáció?"},{"category":"ambiguous","expected_alternatives":["core-agent-systems","evaluation-and-improvement"],"expected_area_id":null,"expected_module_ids":[],"expected_status":"ambiguous","id":"ambiguous.cross-area.05","query":"Observability vagy workflow?"},{"category":"ambiguous","expected_alternatives":["interaction-and-collaboration","real-time-multimodal"],"expected_area_id":null,"expected_module_ids":[],"expected_status":"ambiguous","id":"ambiguous.cross-area.06","query":"Konkurencia vagy sim2real?"},{"category":"ambiguous","expected_alternatives":["coding-agents","tool-execution"],"expected_area_id":null,"expected_module_ids":[],"expected_status":"ambiguous","id":"ambiguous.cross-area.07","query":"Kódgenerálás vagy MCP?"},{"category":"ambiguous","expected_alternatives":["context-and-knowledge","evaluation-and-improvement"],"expected_area_id":null,"expected_module_ids":[],"expected_status":"ambiguous","id":"ambiguous.cross-area.08","query":"Memória vagy observability?"},{"category":"ambiguous","expected_alternatives":["core-agent-systems","multi-agent-coordination"],"expected_area_id":null,"expected_module_ids":[],"expected_status":"ambiguous","id":"ambiguous.cross-area.09","query":"Workflow vagy society?"},{"category":"ambiguous","expected_alternatives":["interaction-and-collaboration","multi-agent-coordination"],"expected_area_id":null,"expected_module_ids":[],"expected_status":"ambiguous","id":"ambiguous.cross-area.10","query":"Konkurencia vagy peer?"},{"category":"canonical","expected_alternatives":[],"expected_area_id":"multi-agent-coordination","expected_module_ids":["checklist.agent-economy-governance"],"expected_status":"covered","id":"canonical.checklist.agent-economy-governance.01","query":"Multi-agent koordináció — Mit ellenőrizzek ennél: Agentgazdaság governance? (agent gazdasági verseny kontroll)"},{"category":"canonical","expected_alternatives":[],"expected_area_id":"evaluation-and-improvement","expected_module_ids":["checklist.agent-observability"],"expected_status":"covered","id":"canonical.checklist.agent-observability.01","query":"Értékelés és fejlesztés — Mit ellenőrizzek ennél: Agent megfigyelhetőség ellenőrzőlista? (agent megfigyelhetőség)"},{"category":"canonical","expected_alternatives":[],"expected_area_id":"core-agent-systems","expected_module_ids":["checklist.agent-task-contract"],"expected_status":"covered","id":"canonical.checklist.agent-task-contract.01","query":"Agent alaprendszerek — Mit ellenőrizzek ennél: Agent feladatszerződés ellenőrzőlista? (agent feladatszerződés)"},{"category":"canonical","expected_alternatives":[],"expected_area_id":"multi-agent-coordination","expected_module_ids":["checklist.cascade-containment"],"expected_status":"covered","id":"canonical.checklist.cascade-containment.01","query":"Multi-agent koordináció — Mit ellenőrizzek ennél: Agenthiba-kaszkád megfékezése? (hibák kaszkádos felerősödését agentek között)"},{"category":"canonical","expected_alternatives":[],"expected_area_id":"coding-agents","expected_module_ids":["checklist.coding-agent-security"],"expected_status":"covered","id":"canonical.checklist.coding-agent-security.01","query":"Coding agentek — Mit ellenőrizzek ennél: Coding-agent biztonsági ellenőrzőlista? (biztonságos coding agent)"},{"category":"canonical","expected_alternatives":[],"expected_area_id":"coding-agents","expected_module_ids":["checklist.coding-harness-design"],"expected_status":"covered","id":"canonical.checklist.coding-harness-design.01","query":"Coding agentek — Mit ellenőrizzek ennél: Coding harness ellenőrzőlista? (coding agent harness)"},{"category":"canonical","expected_alternatives":[],"expected_area_id":"continual-evolution","expected_module_ids":["checklist.continual-evolution-safety"],"expected_status":"covered","id":"canonical.checklist.continual-evolution-safety.01","query":"Folyamatos agentfejlődés — Mit ellenőrizzek ennél: Folyamatos fejlődés biztonsági kapuja? (önfejlődés biztonsági határ)"},{"category":"canonical","expected_alternatives":[],"expected_area_id":"evaluation-and-improvement","expected_module_ids":["checklist.evaluation-environment-components"],"expected_status":"covered","id":"canonical.checklist.evaluation-environment-components.01","query":"Értékelés és fejlesztés — Mit ellenőrizzek ennél: Értékelési környezet komponensei? (eval környezet komponenslista)"},{"category":"canonical","expected_alternatives":[],"expected_area_id":"real-time-multimodal","expected_module_ids":["checklist.expressive-speech-synthesis"],"expected_status":"covered","id":"canonical.checklist.expressive-speech-synthesis.01","query":"Valós idejű multimodális rendszerek — Mit ellenőrizzek ennél: Kifejező beszédszintézis ellenőrzése? (emberibb beszédszintézis)"},{"category":"canonical","expected_alternatives":[],"expected_area_id":"core-agent-systems","expected_module_ids":["checklist.harness-function-coverage"],"expected_status":"covered","id":"canonical.checklist.harness-function-coverage.01","query":"Agent alaprendszerek — Mit ellenőrizzek ennél: Futtatási keret funkciólefedettsége? (harness ellenőrzőlista)"},{"category":"canonical","expected_alternatives":[],"expected_area_id":"tool-execution","expected_module_ids":["checklist.isolated-tool-execution"],"expected_status":"covered","id":"canonical.checklist.isolated-tool-execution.01","query":"Eszközhasználat — Mit ellenőrizzek ennél: Izolált eszközvégrehajtás? (sandboxolt tool futtatás)"},{"category":"canonical","expected_alternatives":[],"expected_area_id":"context-and-knowledge","expected_module_ids":["checklist.knowledge-freshness-governance"],"expected_status":"covered","id":"canonical.checklist.knowledge-freshness-governance.01","query":"Kontextus és tudás — Mit ellenőrizzek ennél: Tudásfrissességi governance? (tudás frissesség ellenőrzés)"},{"category":"canonical","expected_alternatives":[],"expected_area_id":"context-and-knowledge","expected_module_ids":["checklist.memory-privacy-sanitization"],"expected_status":"covered","id":"canonical.checklist.memory-privacy-sanitization.01","query":"Kontextus és tudás — Mit ellenőrizzek ennél: Memória adatvédelmi tisztítása? (memória privacy ellenőrzés)"},{"category":"canonical","expected_alternatives":[],"expected_area_id":"real-time-multimodal","expected_module_ids":["checklist.mobile-automation-boundary"],"expected_status":"covered","id":"canonical.checklist.mobile-automation-boundary.01","query":"Valós idejű multimodális rendszerek — Mit ellenőrizzek ennél: Mobil automatizálási ökoszisztémahatár? (mobil agent ökoszisztémahatár)"},{"category":"canonical","expected_alternatives":[],"expected_area_id":"multi-agent-coordination","expected_module_ids":["checklist.multi-agent-failure-review"],"expected_status":"covered","id":"canonical.checklist.multi-agent-failure-review.01","query":"Multi-agent koordináció — Mit ellenőrizzek ennél: Multi-agent hibafelülvizsgálat? (multi agent hibamód audit)"},{"category":"canonical","expected_alternatives":[],"expected_area_id":"evaluation-and-improvement","expected_module_ids":["checklist.objective-verifiability"],"expected_status":"covered","id":"canonical.checklist.objective-verifiability.01","query":"Értékelés és fejlesztés — Mit ellenőrizzek ennél: Objektív ellenőrizhetőség? (objektív eval verifier)"},{"category":"canonical","expected_alternatives":[],"expected_area_id":"model-post-training","expected_module_ids":["checklist.post-training-readiness"],"expected_status":"covered","id":"canonical.checklist.post-training-readiness.01","query":"Modell-utótanítás — Mit ellenőrizzek ennél: Utótanítási készenléti kapu? (utótanítási készenlét)"},{"category":"canonical","expected_alternatives":[],"expected_area_id":"evaluation-and-improvement","expected_module_ids":["checklist.privacy-aware-analytics"],"expected_status":"covered","id":"canonical.checklist.privacy-aware-analytics.01","query":"Értékelés és fejlesztés — Mit ellenőrizzek ennél: Adatvédelmi tudatos analitika? (privacy-aware agent analytics)"},{"category":"canonical","expected_alternatives":[],"expected_area_id":"context-and-knowledge","expected_module_ids":["checklist.prompt-injection-boundary"],"expected_status":"covered","id":"canonical.checklist.prompt-injection-boundary.01","query":"Kontextus és tudás — Mit ellenőrizzek ennél: Promptinjekciós határ ellenőrzőlista? (prompt injection határ)"},{"category":"canonical","expected_alternatives":[],"expected_area_id":"interaction-and-collaboration","expected_module_ids":["checklist.shared-state-concurrency-control"],"expected_status":"covered","id":"canonical.checklist.shared-state-concurrency-control.01","query":"Interakció és együttműködés — Mit ellenőrizzek ennél: Közös állapot konkurenciakezelési ellenőrzőlista? (közös állapot zárolás)"},{"category":"canonical","expected_alternatives":[],"expected_area_id":"tool-execution","expected_module_ids":["checklist.tool-result-verification"],"expected_status":"covered","id":"canonical.checklist.tool-result-verification.01","query":"Eszközhasználat —